{
  "format": "accessconverter",
  "formatVersion": 1,
  "producer": "AccessConverter",
  "layout": "document",
  "encoding": {
    "rows": "object",
    "bigint": "number",
    "decimals": "number",
    "hyperlinks": "string",
    "binary": "base64",
    "ole": "raw"
  },
  "source": {
    "file": "attachments.accdb",
    "fileFormat": "V2007",
    "charset": "UTF-16LE"
  },
  "schema": {
    "tables": [
      {
        "name": "Table1",
        "description": null,
        "columns": [
          {
            "name": "ID",
            "type": "int32",
            "accessType": "LONG",
            "nullable": false,
            "required": false,
            "autoNumber": "increment"
          },
          {
            "name": "Comment",
            "type": "string",
            "accessType": "TEXT",
            "nullable": true,
            "required": false,
            "length": 255,
            "allowZeroLength": true
          },
          {
            "name": "Attachments",
            "type": "attachments",
            "accessType": "ATTACHMENT",
            "nullable": false,
            "required": false
          }
        ],
        "primaryKey": {
          "name": "PrimaryKey",
          "columns": [
            {
              "name": "ID",
              "order": "asc"
            }
          ],
          "unique": true,
          "ignoreNulls": false,
          "required": true,
          "accessNames": [
            "PrimaryKey"
          ]
        },
        "indexes": [],
        "validationRule": null
      }
    ],
    "linkedTables": [],
    "relationships": []
  },
  "data": {
    "Table1": [
      {"ID":1,"Comment":"0 Attachments","Attachments":[]},
      {"ID":2,"Comment":"1 Attachment","Attachments":[{"fileName":"attachment1.txt","fileType":"txt","size":12,"data":"QXR0YWNobWVudCAx","url":null,"timestamp":null,"flags":null}]},
      {"ID":3,"Comment":"3 Attachments","Attachments":[{"fileName":"attachment1.txt","fileType":"txt","size":12,"data":"QXR0YWNobWVudCAx","url":null,"timestamp":null,"flags":null},{"fileName":"attachment2.txt","fileType":"txt","size":12,"data":"QXR0YWNobWVudCAy","url":null,"timestamp":null,"flags":null},{"fileName":"attachment3.txt","fileType":"txt","size":12,"data":"QXR0YWNobWVudCAz","url":null,"timestamp":null,"flags":null}]}
    ]
  }
}
